"id","site","job_url","job_url_direct","title","company","location","date_posted","job_type","salary_source","interval","min_amount","max_amount","currency","is_remote","job_level","job_function","listing_type","emails","description","company_industry","company_url","company_logo","company_url_direct","company_addresses","company_num_employees","company_revenue","company_description","skills","experience_range","company_rating","company_reviews_count","vacancy_count","work_from_home_type"
"","japandev","https://japan-dev.com/jobs/ikhor/ikhor-senior-full-stack-engineer-metfhe","","Senior Full Stack Engineer","Kamikai","Tokyo, Japan","2025-12-30","","","","","","","","","","","","About Us

Kamikai Labs is reimagining the future of 2D animation. Through our AI-powered suite of production tools, we help the world’s leading animation studios and indie creators ship higher-quality work faster than ever before. Our products are already in active use across top-tier Japanese studios, and we’re growing quickly as demand accelerates.

We’re now looking for a Senior or Staff Full-Stack Engineer, a strong generalist who loves shipping real products and owning problems end-to-end, to join our Tokyo-based team.

 

in applying to this job listing - please write only 1-3 bullet points about why you are an excellent fit.

 

About the Role

This is a product-driven, high-autonomy engineering role. You’ll work across the entire stack to design, build, and ship user-facing features used daily by professional animators and production teams. You’ll collaborate closely with designers, ML engineers, and founders, but you’ll also be trusted to independently take ideas from concept to production.

We’re looking for engineers who care deeply about shipping, have a strong JavaScript foundation, and can point to real products or systems they’ve built and delivered.

 

Key Responsibilities

Own features end-to-end: scoping, implementation, launch, iteration, and maintenance
Build and ship product-facing web applications with a strong focus on usability and performance
Develop and maintain backend APIs and services that support production workflows
Integrate ML inference endpoints and internal services via clean, reliable APIs
Move quickly in a scrappy environment — while progressively hardening systems for scale
Collaborate with designers and artists to ensure tools match real studio workflows
Improve product quality through thoughtful refactors, testing, and system design
Help shape engineering standards, architecture, and development velocity as the team grows

 

Requirements

Senior- or Staff-level experience as a full-stack engineer
Strong fluency in JavaScript and modern web development
Proven track record of shipping real products — personal projects, startups, or production systems
Comfortable working across frontend, backend, and infrastructure as needed
Experience building and consuming APIs (REST, WebSockets, etc.)
Strong product instincts: you think about users, edge cases, and long-term maintainability
Able to work autonomously, take ownership, and make pragmatic tradeoffs
English fluency required; Japanese is a bonus
Based in Japan or willing to relocate (relocation support provided)

 

Bonus Qualifications

Experience with modern frontend frameworks (React, Svelte, Next.js, etc.)
Backend experience in Node.js, Python, or similar
Familiarity with production databases (Postgres, Redis, etc.)
Experience scaling systems from early-stage to production-grade
Past work in creative tools, SaaS, or developer-facing products
Interest in animation, creative software, or artist workflows

 

Why Join Kamikai?

Ship real products used by some of the best animation studios in the world
High autonomy and ownership in a fast-moving, growing company
Work alongside a deeply creative, technical, and passionate team
Direct influence on product direction, engineering culture, and company trajectory
Competitive compensation, relocation support, and equity","","","","","","","","","","","","","",""
"","japandev","https://japan-dev.com/jobs/hennge/hennge-front-end-engineering-internship-onsite-tokyo-japan-8lbfyd","","Front-end Engineering Internship (Onsite Tokyo, Japan)","HENNGE","Tokyo, Japan","2025-12-26","","","","","","","","","","","","COMPANY OVERVIEW

Established in 1996, HENNGE is one of the first IT ventures in Japan. Controlling a majority of the nation’s market share, we are the leading cloud-based security company based in Tokyo. We aim to become a world-class IT company by expanding our business globally, having English as our official language, and hiring international talents worldwide. We are looking for highly talented and motivated engineers (front-end, back-end, DevOps, mobile development) to join our team in Tokyo

 

Front-end Engineering Internship: Job Description

Ready for a Tech Adventure in Tokyo? Join Our Internship Program – 4-5 Weeks of Software Engineering Internship Await!

Join HENNGE’s Global Internship Program (GIP): Front-End Software Engineering Pathway in Tokyo, Japan. This unique 4-5 week internship at our Shibuya headquarters offers you personal and professional growth in an internationally diverse environment.

In HENNGE’s GIP: Front-end Engineering Pathway, you will acquire practical application development skills primarily in Typescript using React or Vue. GIP will provide you with hands-on experience using state-of-the-art cloud platforms such as Amazon Web Services and offer a real-world experience for application development.

Our primary working language is English, so no Japanese is required. The program is held at our Shibuya headquarters in Tokyo for 4-5 weeks, Monday to Friday, from 10 AM to 7 PM (JST). As the entire HENNGE’s engineering team is based in the same office, interns will have the opportunity to communicate directly with mentors and other engineers. While the program is unpaid, we provide comprehensive subsidies, and outstanding participants may be offered full-time employment opportunities.

If you are interested in HENNGE’s GIP: Full Stack Engineering Pathway, please check it out here.

Internship Overview

Build real-world applications using TypeScript with React or Vue.
Sharpen your skills in front-end frameworks while designing user experiences that matter.

Program Structure
Weeks 1-4: Application Development Project
Week 5: DevOps Project
Benefits 
Round-trip airfares from and back to your country of residence
Pre-arrival support and visa guidance
Medical insurance* and a phone with mobile data will be provided during your internship in Tokyo, Japan**
Up to 150,000 JPY of monthly subsidy to cover accommodation, meals, transportation, and networking activities
Subsidized company events on top of monthly subsidy (Monthly Technical Sessions, Board Game Night, Get-to-know-you Lunches, and many others!) to get to know teams across divisions
Access to online learning platform during the internship period

* Medical insurance will only be provided to interns who do not reside in Japan
** This internship is an unpaid training program with a subsidy provided to all interns

Essential Qualifications
Third-year undergraduate or higher (including Master's and Doctoral students). Recent graduates are also welcome to apply
Pursuing or holding a degree in Computer Science or a related field. If not, equivalent experience from a tech internship or bootcamp is expected
Fluency in English (Japanese not required)
Proficiency in frontend frameworks such as React or Vue in Typescript, preferably with knowledge of the nuances of building at scale such as form validation, data fetching and state management
Knowledge of Linux / MacOS / Unix-like environments
Interested in open source or tech community activities
Interested in pursuing a career in Japan

At least meet three of the following:

Experience in cloud computing platforms, especially AWS
Experience in full stack web application development
Proficiency in Python or Go
Knowledge of distributed systems
Knowledge of DevOps tools and practices (CI/CD, Infrastructure as Code)
Experience in software testing methodologies (unit testing, integration testing, end-to-end testing)
Experience with UI/UX design tools, especially Figma
Experience implementing responsive web design in a web app
Experience implementing SSO in a web app
Our Ideal Candidate

Our ideal candidate is more than just a front-end developer - they’re a curious builder with a broad technical perspective. We're especially excited about applicants who:

Have experience in back-end or full stack development
Are familiar with DevOps practices and tools like CI/CD pipelines or cloud services
Understand the value of thoughtful UI/UX design
Bring a well-rounded approach to building complete, user-focused products

Bring your range - we want to see the full picture of what you can do.

Internship schedule

We open batches multiple times a year.

Available batch (as of Dec 26)

Batch 5 (2026): Nov 16 - Dec 18 (5 weeks) 
How to apply
Register through the apply button below and verify your email address.
Solve the coding challenge and submit your work with your CV and cover letter.
An HR interview followed by an online interview, will be given to those who pass Step 2.

Notice for Applicants

A limited number of internship slots are available. Applications will be reviewed as they are received, and positions will be filled on a first-come, first-served basis.  We encourage you to apply early, as applications will close once all positions are filled.
The coding challenge has no time limit, and the screening process will not consider solving time. Please note that the application is completed after uploading application documents and filling in the batch preferences.
Please take another challenge if you are (also) interested in applying for HENNGE’s GIP: Full Stack Engineering Pathway. Please use different emails to sign up if you apply for both internships.","","","","","","","","","","","","","",""
"","japandev","https://japan-dev.com/jobs/ai-robot-association/ai-robot-association-airoa-full-stack-engineer-sliy8x","","Full Stack Engineer","AI Robot Association (AIRoA)","Tokyo, Japan","2025-12-16","","direct_data","yearly",6000000.0,20000000.0,"JPY","","","","","","Description

About AIRoA

The AI Robot Association (AIRoA) is launching a groundbreaking initiative: collecting one million hours of humanoid robot operation data with hundreds of robots, and leveraging it to train the world’s most powerful Vision-Language-Action (VLA) models.

What makes AIRoA unique is not only the unprecedented scale of real-world data and humanoid platforms, but also our commitment to making everything open and accessible. We are building a shared “robot data ecosystem” where datasets, trained models, and benchmarks are available to everyone. Researchers around the world will be able to evaluate their models on standardized humanoid robots through our open evaluation platform.

 

For researchers, this means an opportunity to:

Work on fundamental challenges in robotics and AI: multimodal learning, tactile-rich manipulation, sim-to-real transfer, and large-scale benchmarking.
Access state-of-the-art infrastructure: hundreds of humanoid robots, GPU clusters, high-fidelity simulators, and a global-scale evaluation pipeline.
Collaborate with leading experts across academia and industry, and publish results that will shape the next decade of robotics.
Contribute to an initiative that will redefine the future of embodied AI—with all results made open to the world.

 

Key Responsibilities

Design, develop and implement teleoperation systems, including real‑time control, low‑latency audio/video streaming and operator-facing interfaces.
Work closely with robot operators to gather feedback from real‑world use and continuously improve the user experience.
Provide data‑quality feedback through the teleoperation UI to encourage higher‑quality data collection.
Develop and maintain applications that support data collection, such as internal tools and dashboards.
Build intuitive web‑based interfaces for managing and monitoring data pipelines.
Collaborate with VLA teams and Data/ML platform teams to ensure seamless data ingestion and workflow management.
Design and implement APIs to facilitate data interactions between internal services and external data sources.
Develop configuration‑management systems to store and update metadata, including robot configurations and task descriptions.
Ensure secure communication through robust authentication and access‑control mechanisms.

 

Requirements

Required Qualifications

Bachelor’s degree in Computer Science or a related field (or equivalent practical experience).
4+ years of professional experience as a full‑stack engineer.
Proficiency in frontend frameworks such as Next.js, React or Vue.
Proficiency in implementing backend solutions using such technologies as Go and Python FastAPI.

 

Preferred Qualifications

Experience developing real-time dashboards, robot control interfaces, or similar applications.
Experience with web crawling and large-scale data processing is a plus.
Familiarity with cloud platforms such as AWS, GCP or Azure.
Strong understanding of web/mobile app development and real‑time communication protocols (WebSocket, MQTT, gRPC).
Experience with ROS/ROS2 and related web tools (e.g., ROSBridge, Foxglove, Webviz).
Familiarity with robot telemetry, sensor data visualization, and live camera feeds.
Experience optimizing system performance using performance analysis tools.

 

Benefits

There are currently no comparable projects in the world that collect data and develop foundation models on such a large scale. As mentioned above, this is one of Japan’s leading national projects, supported by a substantial investment of 20.5 billion yen from NEDO.

This position will play a crucial role in determining the success of the project. You will have broad discretion and responsibility, and we are confident that, if successful, you will gain both a great sense of achievement and the opportunity to make a meaningful contribution to society.

Furthermore, we strongly encourage engineers to actively build their careers through this project—for example, by publishing research papers and engaging in academic activities.","","","","","","","","","","","","","",""
