"id","site","job_url","job_url_direct","title","company","location","date_posted","job_type","salary_source","interval","min_amount","max_amount","currency","is_remote","job_level","job_function","listing_type","emails","description","company_industry","company_url","company_logo","company_url_direct","company_addresses","company_num_employees","company_revenue","company_description","skills","experience_range","company_rating","company_reviews_count","vacancy_count","work_from_home_type"
"","japandev","https://japan-dev.com/jobs/zeals/zeals-security-engineer-9u6uc2","","Security Engineer","Zeals","Remote, Japan","2026-01-23","","","","","","","","","","","","Are you looking to:

Make meaningful changes at the fastest-growing tech company in Japan?
Work in a fair, highly flexible, and inclusive environment where anyone can make an impact?
Build the next bold idea in conversational commerce technology?

We Are Zeals – “Designing conversations. Driving conversions.”

Zeals is changing how consumers purchase online through AI-powered, human-designed conversation flows. With over 480 enterprise clients in Japan and nearly $40 million in recent funding (backed by Salesforce Ventures), we are poised for exponential growth in the US and global markets. Our goal is simple: to revolutionize hospitality on the internet.

 

Your Typical Day With Us

Assess & Test: Conduct vulnerability assessments and penetration tests on systems, networks, and applications.
Design Review: Review product designs and system architectures to identify security risks early using threat modeling.
Code Security: Perform source code reviews to detect flaws before deployment.
Incident Response: Investigate, analyze, and respond to security incidents and threats in a timely manner.
DevSecOps: Integrate automated security checks and testing into CI/CD pipelines for scalable security practices.
Guidance: Educate engineering teams through workshops and secure coding best practices.
Strategy: Analyze security metrics and trends to identify areas for improvement and adjust strategies accordingly.

 

What You’ll Need

3–5 years of experience in information security, network security, or a similar role.
Hands-on experience with threat and vulnerability management.
Proficiency in network and system security (Firewalls, IDS/IPS, VPNs).
Experience with security auditing tools and penetration testing.
Familiarity with security frameworks and regulations (e.g., NIST, ISO 27001, GDPR).

 

What Makes You Stand Out

Knowledge of cloud security concepts and experience working with cloud platforms (AWS, GCP).
Proficiency in scripting languages (Python, JavaScript, Golang) for automation.
Experience leading, executing, or coordinating security-related projects.
Relevant professional certifications (e.g., CISSP, CEH, CompTIA Security+, or GIAC).

 

Our Tech Stack

Languages: Go, Python, Elixir, TypeScript (React.js)
Infrastructure: Google Cloud Platform (GCP), Kubernetes, Terraform
Data & Search: MongoDB, MySQL, Postgres, BigQuery, Elasticsearch, Qdrant
CI/CD & Monitoring: GitHub Actions, ArgoCD, CircleCI, Grafana, Opsgenie

 

Perks & Benefits

Flexibility: Remote-first organization (in Japan) with interim work-from-overseas options.
Growth: Performance reviews twice a year and a competitive salary.
Support: Visa sponsorship and housing allowance (for those living within 1.5km of the office).
Time Off: 10 days annual leave (first year), 5 refreshment leave days, plus national and seasonal holidays.
Culture: Team building/lunch allowances and the ""Zeals Bar"" bi-monthly free-flow beer party.

 

Ready to roll up your sleeves?
We're obsessed with bringing hospitality to everyone. We promise a once-in-a-lifetime experience and coworkers you’ll be proud to brag about. If you're ready to change the status quo, join us!","","","","","","","","","","","","","",""
"","japandev","https://japan-dev.com/jobs/jamm/jamm-backend-developer-n7o3sk","","Backend Developer","Jamm","Tokyo, Japan","2026-01-22","","direct_data","yearly",7000000.0,10000000.0,"JPY","","","","","","About

We're looking for a backend engineer to design and build systems that power payment infrastructure. You'll own features end-to-end, from database schema design through deployment, and work alongside a small, tight-knit team of experienced engineers who ship fast and iterate constantly!

 

Responsibilities

Design, implement, and maintain high-performance backend services in Go.
Architect scalable data models and database schemas for new product features.
Build and operate workflow orchestration systems to handle complex payment sequences.
Identify and address technical debt while balancing rapid delivery timelines.
Participate in peer system design reviews and thorough code reviews.
Monitor, debug, and continuously improve overall system reliability.

 

Requirements

Experience: At least 1 year of professional backend software development experience.
Technical Proficiency: Strong proficiency in Golang and relational database design (PostgreSQL preferred).
Orchestration: Experience with workflow orchestration systems such as Temporal or AWS Step Functions.
System Design: Solid understanding of distributed systems patterns and architectural trade-offs.
Delivery: Proven track record of delivering stable features in production environments.
Documentation: Experience writing technical design docs, API specs, or SDK documentation.

 

Preferred Qualifications

2–5 years of professional software development experience.
Experience shipping a product from zero to production (strongly preferred).
Background in Fintech or Payments industries.
Familiarity with Infrastructure-as-Code (Terraform) and gRPC/Protocol Buffers.
Experience working in early-stage, fast-paced companies.
Familiarity with fullstack, mobile, or modern frontend frameworks.","","","","","","","","","","","","","",""
"","japandev","https://japan-dev.com/jobs/money-forward/money-forward-senior-software-engineer-partner-product-development-department-tokyo-fzwt1h","","Senior Software Engineer (Partner Product Development Department)","Money Forward","Tokyo, Japan","2026-01-22","","direct_data","yearly",5800000.0,10000000.0,"JPY","","","","","","Overview

You will be assigned to the Partner Product Development Department of Business Segment SMB Domain, responsible for overseeing the product line for partner professionals (accounting firms and labor and social security attorney offices) that make up a significant part of Money Forward Business Segment's business. The Partner Product Development Department aims to continuously solve various challenges faced by users in Japanese accounting firms. By advancing this project, we aim to improve the productivity of our crucial partners, increase the value they generate, and achieve mutual growth with Money Forward.

 

Responsibilities and Duties

The Cloud Partner Group sets forth the product vision of ""advancing the advisory experience for professionals,"" recognizing the significant role professionals play in the growth of small and medium-sized businesses. However, a considerable amount of time is often spent on paper-based management tasks such as receipt management and various application form preparations, limiting resources for advisory services.

Promote the digital transformation of SMEs through our back-office SaaS series, Money Forward Cloud.
Extend new value to professionals, allowing them to direct more focus toward supporting the business growth of SMEs.
Employ Scrum development without dividing team roles between backend and frontend.
Transition to English as the primary language for development by fiscal year 2025.

 

Required Skills and Experience

Bachelor's degree in Computer Science, Engineering, or a related technical field.
5+ years of web application development experience (application design, development, and operation).
Expertise in either React, Next.js, and GraphQL; Java/Server-side Kotlin and Springboot; or Ruby on Rails.
Experience with frontend and/or backend development in a full-stack web framework.
Experience in designing and deploying cloud infrastructure.
Willingness to work as a full-stack engineer, irrespective of technology or programming language.
Capable of relocating to Japan and commuting to the Tokyo office at least twice a week.

 

Preferred Skills and Experience

Conversational level in Japanese.
Experience with backend development using Ruby on Rails and RDBMS.
Experience in system architecture design, microservices, and microservice development.
Experience working in a Scrum team and practicing DevOps.
Experience in container-based development and proficiency in test-driven development.
Experience in AI development and/or experience in using AI tools to improve development processes.

 

Language Requirements

English: TOEIC score of 700 or above, plus the ability to handle meetings and text communication in English. (Equivalent qualifications like TOEFL iBT 60+, IELTS 5.0+, or Cambridge FCE are also accepted).
Japanese: No Japanese Language Requirement but willingness to learn. Conversational Japanese is a plus.

 

Technology Stack & Tools

Backend: Kotlin, GraphQL, Ruby on Rails
Frontend: React.js, Next.js, TypeScript
Middleware: MySQL, Kafka, Debezium
Infrastructure: AWS, Docker, Kubernetes, Terraform
CI/CD: CircleCI, GitHub Actions, Argo CD
Monitoring: Datadog, Rollbar
Management: JIRA, Slack, Zoom

 

Work Environment

Provided PC Specs: Latest CPU-equipped PCs (MacOS or Windows) with customization options based on requirements.
Development Support: Peripherals (displays, mice, keyboards) can be purchased as office supplies.
Money Forward Library: System to borrow or purchase technical/management books at the company's expense.
Professional Growth: Partial coverage for domestic and international conferences such as RubyKaigi and Google I/O.
Incentives: Referral reward system and coverage for recruitment meals.","","","","","","","","","","","","","",""
"","japandev","https://japan-dev.com/jobs/mujin/mujin-frontend-engineerandroid-heavy-react-secondary-68n4i2","","Frontend Engineer (Android)","Mujin","Tokyo, Japan","2026-01-22","","direct_data","yearly",8000000.0,12000000.0,"JPY","","","","","","About Mujin

Mujin creates MujinOS, the intelligent operating system for industrial robotics. By leveraging real-time digital twins, MujinOS seamlessly connects and orchestrates equipment to achieve fully autonomous operations.

At our core is Machine Intelligence (MujinMI), a unique approach offering advanced perception, planning, and control algorithms that solve the most challenging automation problems. Trusted by globally recognized companies, we are redefining supply chain efficiency. Headquartered in Japan with growing teams in China, the US, and Europe, we invite you to join a dynamic environment where you can shape the future of automation.

 

Team Introduction

As a Software Engineer on Mujin’s Warehouse Execution System (WES) & Fleet Management (FM) team, you will focus on developing user-facing Android and web frontend applications used daily in warehouse operations. Your work directly shapes how operators interact with warehouse systems through industrial Android devices and browser-based interfaces.

The team specializes in building reliable, high-quality frontends that run in demanding production environments, where stability, performance, and usability are critical. You will work closely with backend engineers, product managers, designers, and operations teams to deliver intuitive, responsive, and maintainable interfaces.

 

Responsibilities

Android

Design, develop, and maintain Android applications for industry devices used in warehouse environments.
Implement features that interface directly with device hardware layers (barcode scanners, cameras, physical buttons, NFC/RFID, Bluetooth, etc.).
Work with vendor-specific SDKs and build applications optimized for offline usage and long-running sessions.

Web Frontend

Develop web frontend applications using React and TypeScript.
Ensure applications are responsive, accessible, and optimized for performance across browsers and devices.

Collaboration & Quality

Collaborate with cross-functional teams (PMs, Designers, Backend, Ops).
Participate in code reviews, knowledge sharing, and mentoring.
Triage, debug, and resolve mission-critical production issues across Android and web systems.

 

Tech Stack

Android: Kotlin, React Native, Android SDK, Android Jetpack, AOSP-based devices.
Web Frontend: TypeScript, React, Rsbuild, Vitest, ESLint.
Backend & Infrastructure: Python, RESTful APIs, GraphQL, Docker.
Collaboration: Figma, Confluence, GitLab.

 

Requirements

Minimum Qualifications

3+ years of professional software development experience.
Professional experience developing Android applications using Kotlin and/or Java.
Strong knowledge of JavaScript, TypeScript, React, and CSS.
Experience integrating applications with device hardware features or SDKs.
Experience with testing frameworks and CI/CD pipelines.

Preferable Qualifications

Experience developing applications for industrial devices.
Proven experience maintaining shared frontend libraries or component systems.
Familiarity with PixiJS, rich animations, or interactive UIs.
Experience with offline-first design and data synchronization.

 

Work Environment & Benefits

Location: Tatsumi, Koto-Ku, Tokyo.
Work Hours: 8:45 - 17:45 (includes 60-minute break).
Salary: Based on experience; revision twice a year; performance bonuses available.
Food & Health: Free buffet lunch every workday, free snacks/drinks, and access to an exclusive employee gym.
Relocation Support: Visa sponsorship, flight ticket support, shipping expense coverage, and housing assistance.

 

Interview Process

Coding Assessment
HR Interview
Hiring Manager Interview (1-2 rounds)
Take-Home Assignment & Feedback (If applicable)","","","","","","","","","","","","","",""
"","japandev","https://japan-dev.com/jobs/metanomaly/mewtant-growth-engineer-so4y2r","","Growth Engineer","Metanomaly","Tokyo, Japan","2026-01-20","","","","","","","","","","","","What you’ll do
Rapidly design and implement lightweight technical solutions to test growth and product hypotheses in user-facing flows
Hack together and ship frontend-driven experiments and features that improve activation, conversion, or engagement
Implement A/B tests and instrumentation pragmatically, optimizing for learning speed while maintaining experiment validity
Iterate aggressively based on results, user feedback, and constraints, prioritizing impact over elegance when appropriate
 
Requirements
Strong frontend engineering skills, with clear ownership of user-facing features and product UI quality
Strong at implementing backend logic and API integrations, as needed.
Able to turn vague growth ideas into concrete, shippable technical solutions
Solid intuition for user behavior, funnels, and friction in real products
Data-literate: can write basic SQL to sanity-check outcomes and guide iteration
Bias toward speed and impact over perfect architecture
 
Experience
3–5+ years of experience building and iterating on products used by real users
Proven experience shipping frontend features used by real users, with iteration based on feedback or data
Experience with product iteration, growth-related work, or independent app development is a strong plus
 
Education
Bachelor’s degree or above. Practical skills, judgment, and shipped work matter more than formal credentials.
 
Nice to have
Interest in anime, otaku culture, creator communities, or related consumer products.
Interest in AI generation
 
Note:
If you've read this, please tell us the names of your top 5 favorite niche anime at the end of your message.","","","","","","","","","","","","","",""
"","japandev","https://japan-dev.com/jobs/money-forward/money-forward-security-specialist-ciso-office-tokyojapandev-o27pc7","","Security Specialist (CISO Office - Tokyo)","Money Forward","Tokyo, Japan","2026-01-16","","direct_data","yearly",8000000.0,17000000.0,"JPY","","","","","","Overview

At Money Forward, we develop a wide range of popular services, including our automated personal financial management tool ""Money Forward ME"" and the ""Money Forward Cloud"" suite for businesses. Our ecosystem is powered by advanced technologies such as ""Account Aggregation"" and our single sign-on system, ""Money Forward ID.""

As our services handle sensitive financial data, we maintain the highest standards of security. The CISO Office works closely with our business units to ensure and enhance the security of our products. This includes the governance and visualization of major cloud platforms like AWS and GCP, as well as the design, implementation, and operation of common security features such as WAF. Additionally, the CISO Office is responsible for strengthening the security of our internal information systems.

To provide a safe and secure experience for even more users, we are looking for a Security Specialist to join our team.

 

About the CISO Office

Our mission is to ""Maximize the value delivered to our customers through security."" We define and create the ideal security state for the entire Money Forward Group.

Preventing service downtime and information leakage is, of course, critical. However, that is only one part of what we value. Excessive security measures can slow down development, potentially reducing or delaying the value we provide to our customers. As security professionals, we constantly ask ourselves how we can maximize customer value and implement the most optimized security solutions to achieve that goal.

 

Security Principles

Embedded security in business strategy: We design security measures in alignment with business strategies, taking into account the current business phase, costs, and potential loss in the event of a risk.
Advanced balancing between security and experience: Over-securing can compromise user convenience. We assess risks to achieve a sophisticated balance between convenience and security, actively promoting automation and autonomous systems.
Autonomous and scalable organization of security: Each development department must be able to build secure services autonomously. The CISO Office focuses on building the frameworks and support necessary to enable this autonomy.

 

Responsibilities and Duties

In this position, you will leverage your knowledge and experience in coding and infrastructure to maintain and enhance the security of Money Forward in collaboration with developers and IT infrastructure teams. Key initiatives include:

Establishment of security guardrails for AWS, Azure, and GCP environments.
In-house security consulting: Providing technical advice and architecture reviews for our developers.
Vulnerability assessments and penetration testing: Performing or supporting security evaluations.
Vulnerability intelligence: Collecting and verifying vulnerability information, including OSINT.
Security tool development: Developing tools and scripts to automate or enhance security.
Framework implementation: Implementing and deploying security frameworks such as NIST CSF and CIS Controls.
DevSecOps implementation: Integrating security into modern development workflows (K8s, Docker, CI/CD).

 

Required Skills and Experience

Foundational understanding of computer science (networking, OS, data structures, and cryptography).
Experience in software development with at least one programming language, or hands-on experience practicing Security by Design.
Business-level English communication skills.
Knowledge or experience in any of the following areas:
Vulnerability assessment or Penetration testing
Forensics, malware analysis, or incident response
Cloud security or Architecture reviews
Building and operating DevSecOps workflows
Implementation of security solutions (e.g., WAF, IDS/IPS, SIEM)

 

Preferred Skills and Experience

Business-level Japanese communication skills.
Experience participating in CTFs, bug hunting, or obtaining CVEs.
Relevant certifications such as CISSP, CISM, OSCP, or GCIH.
Deep understanding of Authentication and Authorization (e.g., OIDC, OAuth).
Experience in security-related operations within the Financial or Fintech industry.
Experience in AI development or using AI tools to improve development processes.

 

Language Requirements

English: Business level

 

Work Environment

At Money Forward, we provide an environment where we can create world-class services together, and we are looking forward to welcoming you.

Provided PC Specs: Latest CPU-equipped PC (MacOS or Windows). Custom-made PCs tailored to business requirements are possible.
Systems to Enhance the Development Environment: Peripheral devices (displays, mice, keyboards) can be purchased as office supplies.
Money Forward Library: A library system where you can freely borrow or request books at the company's expense.
Referral Driven: Coverage for recruitment meals and a referral reward system.
Conference Participation Support: Partial coverage for domestic and international conferences like RubyKaigi and Google I/O.","","","","","","","","","","","","","",""
"","japandev","https://japan-dev.com/jobs/mujin/mujin-senior-software-engineer-wes--fm-uhpwd5","","Senior Software Engineer (C++ & Python)","Mujin","Tokyo, Japan","2026-01-15","","direct_data","yearly",8000000.0,13000000.0,"JPY","","","","","","Mujin develops ""MujinController,"" a platform that leverages a real-time digital twin and advanced robotics to seamlessly connect industrial equipment for fully autonomous operations.

Driven by our unique approach towards Robotics Machine Intelligence (MujinMI), we offer a robust suite of perception, planning, and control algorithms, enabling autonomous robot movement and transforming automation in challenging industrial environments.

Trusted by globally recognized companies, our cutting-edge technology enhances efficiency and innovation across the supply chain. With headquarters in Japan and expanding offices in China, the US, and Europe, Mujin offers a dynamic, fast-growing environment where your work directly shapes the future of automation.

 

Team Introduction

As a Software Engineer on Mujin's Warehouse Execution System (WES) & Fleet Management (FM) team, you will play a key role in designing, developing, and deploying Mujin’s advanced warehouse execution and fleet management systems. Our team works at the intersection of robotics, automation, and software engineering to optimize warehouse operations and ensure seamless orchestration of robots and industrial equipment.

 

Responsibilities

 Design, develop, and maintain WES software to manage warehouse inventory, scheduling, and order fulfillment.
 Implement and integrate drivers for industrial hardware, including robots, conveyors, 3D cameras, sensors, PLCs, AGVs, ASRS, and WMS.
 Work with real-time operating systems (RTOS) and network protocols to ensure system efficiency and low-latency communication.
 Ensure system security by implementing robust encryption and access control mechanisms.
 Design and optimize high-performance backend services and APIs for seamless integration with third-party warehouse software.
 Develop and enhance scalable HTTP servers to handle large-scale warehouse operations.
 Collaborate closely with backend and frontend teams to improve system usability and user experience.
 Maintain code quality and testing frameworks to ensure high system reliability.
 Occasionally travel to customer sites, both domestically and internationally, for deployment and support.
 Tackle complex technical challenges in a fast-paced environment.
 Take on additional tasks related to the above responsibilities as needed.

 

Minimum Requirements

BSc degree or higher in Computer Science, Computer Engineering, or related fields, or equivalent academic or work experience
Excellent experience and high proficiency in C++ and Python
Advanced Linux user, with excellent experience in Linux software development
Expert in Linux internals, networking stack, network protocols, routing, async I/O, Docker and its internal workings
Experience in full-stack development
Technical communication skills in English

 

Preferable Requirements

Expert in real-time OS, Linux kernel module development, EtherCAT
Experience in robotic software development

 

Attractiveness

We are looking for those who are prepared to dedicate themselves to facing big challenges, work proactively and independently, and take ownership when working with members across the teams!
You will get your “hands dirty” working on all aspects of the industrial robot controller, not being confined to a specific component in the system. The work is challenging, mostly like something that you have never done before, requiring extensive research.
Since the work is widely applicable, it will affect everyone in the engineering team, making the WES & FM team the likely “go-to” people. You will have chances to travel and work onsite to integrate cutting-edge industrial systems such as AGVs and ASRS.","","","","","","","","","","","","","",""
